<?xml version="1.0" encoding="UTF-8"?>
<class xmlns:xsi="http://www.w3.org/2001/XMLSchema-instance" xsi:noNamespaceSchemaLocation="./schema.xsd">
    <student id="1">
        <firstName>Руслан</firstName>
        <lastName>Иванов</lastName>
    </student>
    <student id="2">
        <firstName>Людмила</firstName>
        <lastName>Петрова</lastName>
    </student>
    <teacher>Ruslan</teacher>
</class>
